Review,Rating,Timestamp
"I bought this phone last month and the battery life is incredible. Easily lasts 2 days!",5,2024-10-01
"The delivery was delayed by over a week. I needed this urgently and it was a big letdown.",2,2024-10-02
"Packaging was excellent and the product works as expected. Definitely recommend it.",4,2024-10-03
"The customer service agent was not helpful and kept transferring my call. Very poor support.",1,2024-10-04
"I love this product! It’s sleek, durable, and performs better than advertised.",5,2024-10-05
"Item arrived damaged and the return process was complicated. Not satisfied.",2,2024-10-06
"Setup instructions were clear and everything was in the box. Worked like a charm.",4,2024-10-07
"I expected more for the price I paid. It's just average in terms of performance.",3,2024-10-08
"Fast delivery and amazing follow-up service from the seller.",5,2024-10-09
"Received the wrong color variant even after selecting correctly. Disappointed.",2,2024-10-10
"Had a problem with one of the parts, but support shipped a replacement quickly.",4,2024-10-11
"The audio quality is subpar, especially in noisy environments.",2,2024-10-12
"My issue was resolved within 24 hours of raising a ticket. Great service!",5,2024-10-13
"This product is not compatible with older devices, which should have been mentioned.",3,2024-10-14
"Very poor packaging. The box was torn and the seal was broken.",1,2024-10-15
"Everything was as expected. Good quality, timely delivery, and great price.",4,2024-10-16
"The device heats up too quickly even during moderate use. Disappointed.",2,2024-10-17
"One of the best purchases I’ve made this year. Works perfectly with all accessories.",5,2024-10-18
"The packaging was okay, but it lacked bubble wrap. Could’ve been safer.",3,2024-10-19
"Impressed by the after-sales service. They replaced my charger without hassle.",5,2024-10-20
